{
  "id": "ogre",
  "name": "Ogre",
  "description": "Twice a man's height and as patient as a landslide.",
  "hp": 68,
  "armorClass": 11,
  "speed": 40,
  "level": 2,
  "abilities": {
    "str": 19,
    "dex": 8,
    "con": 16,
    "int": 5,
    "wis": 7,
    "cha": 7
  },
  "proficiencies": [
    "weapons"
  ],
  "items": [
    "ogre-greatclub"
  ],
  "darkvision": 60,
  "loot": {
    "coins": "2d10"
  },
  "token": {
    "color": [
      150,
      140,
      100
    ],
    "size": 0.6
  },
  "ai": "brute"
}
