{
  "id": "bear",
  "name": "Grizzly Bear",
  "description": "Big enough to go where it likes.",
  "level": 3,
  "hp": 45,
  "armorClass": 17,
  "speed": 35,
  "abilities": {
    "str": 20,
    "dex": 12,
    "con": 18,
    "int": 2,
    "wis": 14,
    "cha": 8
  },
  "proficiencyRanks": {
    "weapons": "trained",
    "dc": "trained",
    "fortitude": "trained",
    "reflex": "trained",
    "will": "trained",
    "perception": "trained"
  },
  "items": [
    "fangs"
  ],
  "token": {
    "color": [
      120,
      85,
      60
    ],
    "size": 0.5
  },
  "ai": "brute",
  "stats": {
    "attack": 11
  }
}
