{
  "id": "ghoul",
  "name": "Ghoul",
  "description": "Eats the dead and freezes the living with a scratch.",
  "hp": 22,
  "armorClass": 12,
  "speed": 30,
  "level": 1,
  "abilities": {
    "str": 13,
    "dex": 15,
    "con": 10,
    "int": 7,
    "wis": 10,
    "cha": 6
  },
  "proficiencies": [
    "weapons"
  ],
  "items": [
    "claws"
  ],
  "darkvision": 60,
  "dcAbility": "con",
  "actions": [
    "ghoul-touch"
  ],
  "stats": {
    "immune.poison": 1
  },
  "token": {
    "color": [
      120,
      140,
      130
    ],
    "size": 0.4
  },
  "ai": "cunning"
}
