{
  "id": "troll",
  "name": "Troll",
  "description": "Long-armed, hungry, and hard to keep down: its wounds close as you watch.",
  "hp": 84,
  "armorClass": 15,
  "speed": 30,
  "level": 5,
  "abilities": {
    "str": 18,
    "dex": 13,
    "con": 20,
    "int": 7,
    "wis": 9,
    "cha": 7
  },
  "proficiencies": [
    "weapons"
  ],
  "items": [
    "troll-claws"
  ],
  "darkvision": 60,
  "actions": [
    "multiattack",
    "regeneration"
  ],
  "token": {
    "color": [
      90,
      120,
      80
    ],
    "size": 0.4
  },
  "ai": "brute"
}
